,Unnamed: 0,codingWeek,channelId,videoId,title,publishedAt,viewCount,likeCount,dislikeCount,commentCount,duration,channelTitle,subscriberCount,country,videoURL
0,0,2020-02-16-2020-02-23,UCzznO4xSV8BKnUBPyswtCUw,ZC0gww2yznI,Chinese scientists says COVID-19/coronavirus could have originated from government ...,2020-02-17T00:15:32Z,4330572,18093.0,1980.0,7431.0,121,ARIRANG NEWS,397000,Unknown,https://www.youtube.com/watch?v=ZC0gww2yznI
1,1,2020-02-16-2020-02-23,UCElSxbeJh0r1B3KUQT1k4eA,HSGbs0GwJUM,?Que es el Coronavirus? Causas y origen,2020-02-19T19:34:00Z,2605169,25064.0,2025.0,72.0,293,Top Doctors LATAM,140000,MX,https://www.youtube.com/watch?v=HSGbs0GwJUM
2,2,2020-02-16-2020-02-23,UCMSsLqxqvZsNXi0Z-VjN89A,V-7SQGPkijs,Coronavirus Autopsy Report Analysis by Dr. Mike | COVID-19 Autopsy,2020-02-21T17:45:00Z,1842712,66967.0,1329.0,6830.0,623,Doctor Mike Hansen,385000,US,https://www.youtube.com/watch?v=V-7SQGPkijs
3,3,2020-02-16-2020-02-23,UCATNzbTbfeoMhNonZGZmrhA,sHP0UIdZyI4,What Is Coronavirus (COVID-19)?,2020-02-19T17:18:11Z,1760303,9333.0,1021.0,646.0,271,Johns Hopkins Medicine,195000,US,https://www.youtube.com/watch?v=sHP0UIdZyI4
4,4,2020-02-16-2020-02-23,UCTrQ7HXWRRxr7OsOtodr2_w,rI_MG3ZnDak,How North Korea is reporting on coronavirus (English subtitles),2020-02-17T18:01:46Z,1465772,20376.0,539.0,5463.0,511,Channel 4 News,1430000,GB,https://www.youtube.com/watch?v=rI_MG3ZnDak
5,5,2020-02-16-2020-02-23,UCYpRDnhk5H8h16jpS84uqsA,qGXfijNZug4,Comment le coronavirus defie la censure chinoise,2020-02-18T15:23:08Z,1153366,19494.0,692.0,2345.0,421,Le Monde,885000,FR,https://www.youtube.com/watch?v=qGXfijNZug4
6,6,2020-02-16-2020-02-23,UC4SUWizzKc1tptprBkWjX2Q,WZjNtxofkXM,Disinfection tunnels built to clean people within 20 seconds amid coronavirus outbreak,2020-02-17T13:58:47Z,1038009,9568.0,282.0,1675.0,81,South China Morning Post,1370000,HK,https://www.youtube.com/watch?v=WZjNtxofkXM
7,7,2020-02-16-2020-02-23,UCDpHc1LkcEpiWR0q7ll5eZQ,bG6zISnenPg,NETEC: Personal Protective Equipment for COVID-19,2020-02-18T15:37:06Z,536920,N/A,N/A,N/A,1080,The NETEC,1990,US,https://www.youtube.com/watch?v=bG6zISnenPg
8,8,2020-02-16-2020-02-23,UCawhykebEeDYMLFNeEdnX7g,6HhnfThnaFo,SYAxRIA E07 : The Wuhan Virus AKA Covid-19,2020-02-21T11:58:52Z,352023,9455,405,606,1198,Dee Kosh,380000,SG,https://www.youtube.com/watch?v=6HhnfThnaFo
9,9,2020-02-16-2020-02-23,UCSW0CYhKC1J0cpknZvN8MvQ,Wx7-fiTaAH0,Hoe is het coronavirus ontstaan?,2020-02-22T09:00:05Z,228327,1498,112,296,271,Universiteit van Nederland,142000,NL,https://www.youtube.com/watch?v=Wx7-fiTaAH0
10,10,2020-02-16-2020-02-23,UCokz2dt4TnzSx4RkRR6JLoQ,I5XvYFYDeZc,"Dai dich covid -19 hom nay, su tan pha khong tuong.",2020-02-19T02:06:42Z,129386,709,31,67,298,Teaphoto,1270,VN,https://www.youtube.com/watch?v=I5XvYFYDeZc
11,11,2020-02-16-2020-02-23,UCbLPaKaeQo-UTmMXXiQPt-g,FePg3M28qvA,Coronavirus Part 2..- Man Made from Wuhan Secret Lab or a Natural Disaster?  Can China Stop It?,2020-02-18T17:09:13Z,11165,375,15,11,664,Knowledge Capsules by Rajeev Poddar,7430,IN,https://www.youtube.com/watch?v=FePg3M28qvA
12,12,2020-02-16-2020-02-23,UC1mkcTVK2fJbAgNPucLWZag,UDPnwUsW1sg,UNILAB Health Reminders: COVID-19 Q&amp;A,2020-02-20T01:39:49Z,7316,31,2,1,37,UNILAB,25000,PH,https://www.youtube.com/watch?v=UDPnwUsW1sg
13,13,2020-02-16-2020-02-23,UC9xrfT_rWNmPcr-9bP9i4Vw,hPdLs4pdFw0,Iran Students evacuated from China released from Coronavirus quarantine qrnTynh wyrws krwn,2020-02-18T12:09:20Z,2249,66,0,1,59,Persian_boy,47000,IR,https://www.youtube.com/watch?v=hPdLs4pdFw0
14,14,2020-02-16-2020-02-23,UCmU7A6C6dygigjGyWw8zpwg,YwbSsEyaR_o,HANG HIEU CHO AE XEM THAM KHAO MUA COVID-19 KHONG CO GIAO HANG DUOC,2020-02-22T03:29:43Z,1162,11,0,0,296,Trại Tài Gà An Giang,16500,VN,https://www.youtube.com/watch?v=YwbSsEyaR_o
15,15,2020-02-16-2020-02-23,UCVsPa33ZsRPPqXPxpiK54vw,Gz0mxbExqtw,"In the ""Hot Zone:"" Daegu, Korea's coronavirus epicenter",2020-02-21T06:31:05Z,1013,22,1,7,69,Asia Times,2300,Unknown,https://www.youtube.com/watch?v=Gz0mxbExqtw
16,16,2020-02-16-2020-02-23,UCO-nV1DzQXT1liu4r2cvLNw,DdfKXJ_U4L8,CORONAVIRUS Vlog CHINA VISA RUN Kunshan to HONG KONG UPDATE 2/14/20 [?],2020-02-17T04:20:45Z,591,39,2,64,1887,Jamaicafunk,1560,US,https://www.youtube.com/watch?v=DdfKXJ_U4L8
17,17,2020-02-16-2020-02-23,UCtZ_yfUT5I3h8UFG_2bpaNA,LJmXvEv1RTI,HAARP using weather to depopulate. FEMA using CORONAVIRUS to control the sick. Quarantine=FEMA CAMPS,2020-02-20T01:54:03Z,538,12,3,4,414,King Dj-Slim,0,US,https://www.youtube.com/watch?v=LJmXvEv1RTI
18,18,2020-02-16-2020-02-23,UCSk7CHuEgUI1-QZTjuECKDQ,YMCeeMU-0CQ,Dub Mentor - Hysteria (Wuhan Fight Dub),2020-02-21T09:00:10Z,281,12,0,0,295,EnT-T (label),412,Unknown,https://www.youtube.com/watch?v=YMCeeMU-0CQ
19,19,2020-02-16-2020-02-23,UCld203k3DQnK_cTyB4zlo3Q,n1fEvEk8p0k,China Coronavirus Chaos  Prophecy Update,2020-02-16T03:42:09Z,-31,-0.0,-0.0,,365,His Grace I’ll Share,2040,AU,https://www.youtube.com/watch?v=n1fEvEk8p0k
20,20,2020-02-16-2020-02-23,UCld203k3DQnK_cTyB4zlo3Q,fzhU-xYYdRA,"Revelation Plague? Chinese Coronavirus Spreads 2 U.S. Europe &amp; Beyond, Has Potential 2B Worse EVER!",2020-02-16T02:41:30Z,-26,-0.0,-0.0,,301,His Grace I’ll Share,2040,AU,https://www.youtube.com/watch?v=fzhU-xYYdRA
21,21,2020-02-16-2020-02-23,UCld203k3DQnK_cTyB4zlo3Q,2Iyvr8nwxCw,Coronavirus details from the Horses Mouth!,2020-02-20T01:37:04Z,-1,-0.0,-0.0,-0.0,281,His Grace I’ll Share,2040,AU,https://www.youtube.com/watch?v=2Iyvr8nwxCw
