,Unnamed: 0,codingWeek,channelId,videoId,title,publishedAt,viewCount,likeCount,dislikeCount,commentCount,duration,channelTitle,subscriberCount,country,videoURL
0,0,2020-06-28-2020-07-05,UC3XTzVzaHQEd30rQbuvCtTQ,R652nwUcJRA,Coronavirus IX: Evictions: Last Week Tonight with John Oliver (HBO),2020-06-29T06:30:01Z,6891932,138068,5986,24081.0,1139,LastWeekTonight,8340000,Unknown,https://www.youtube.com/watch?v=R652nwUcJRA
1,1,2020-06-28-2020-07-05,UCqVHGwQCmmGa2hjS7ydN4sQ,HIPCdz74XUw,"COVID-19, ?COMO IDENTIFICAR EL DIA 1[?] DE LA ENFERMEDAD",2020-07-04T00:30:09Z,2303948,43700,6526,N/A,1288,Dr. Luis Antonio Pacora Camargo,260000,PE,https://www.youtube.com/watch?v=HIPCdz74XUw
2,2,2020-06-28-2020-07-05,UC9CYT9gSNLevX5ey2_6CK0Q,4sPfRD86URI,Covid-19 News: Corona Vaccine ko lekr PM Modi ne kii baitthk,2020-06-30T12:54:22Z,1505896,8372,1167,253,137,NDTV India,8570000,IN,https://www.youtube.com/watch?v=4sPfRD86URI
3,3,2020-06-28-2020-07-05,UCMSsLqxqvZsNXi0Z-VjN89A,w-NZeaEKRng,ICU Doctor: Top 10 Things I learned Treating Coronavirus Patients | COVID-19,2020-07-02T15:05:28Z,1256053,29904,1301,4397,933,Doctor Mike Hansen,385000,US,https://www.youtube.com/watch?v=w-NZeaEKRng
4,4,2020-06-28-2020-07-05,UC0QHWhjbe5fGJEPz3sVb6nw,flzR0DImUbk,Doctor Fact-Checks President Trump On Coronavirus,2020-07-01T21:00:16Z,1126648,96289,2493,16633,719,Doctor Mike,6120000,US,https://www.youtube.com/watch?v=flzR0DImUbk
5,5,2020-06-28-2020-07-05,UCqVHGwQCmmGa2hjS7ydN4sQ,pWA4viXVaMs,COVID-19[?] CUIDADO [?][?] EVITEMOS LLEGAR AL DIA 6[?]DE LOS SINTOMAS !![?],2020-06-30T00:15:09Z,1092260,22831,1594,1852,1021,Dr. Luis Antonio Pacora Camargo,260000,PE,https://www.youtube.com/watch?v=pWA4viXVaMs
6,6,2020-06-28-2020-07-05,UCupvZG-5ko_eiXAupbDfxWw,A_rMCaYkk68,US sets alarming new coronavirus record,2020-07-02T21:09:41Z,928165,8032,3933,10848,658,CNN,10500000,Unknown,https://www.youtube.com/watch?v=A_rMCaYkk68
7,7,2020-06-28-2020-07-05,UCupvZG-5ko_eiXAupbDfxWw,02Wi5GSkdNk,Maps show explosive growth of coronavirus in US,2020-06-29T21:27:40Z,894879,7667,1639,6104,655,CNN,10500000,Unknown,https://www.youtube.com/watch?v=02Wi5GSkdNk
8,8,2020-06-28-2020-07-05,UCupvZG-5ko_eiXAupbDfxWw,VGZyWPzZu8g,Trump says he believes coronavirus will just disappear,2020-07-01T21:23:37Z,855797,8375,2045,8115,485,CNN,10500000,Unknown,https://www.youtube.com/watch?v=VGZyWPzZu8g
9,9,2020-06-28-2020-07-05,UCQgWpmt02UtJkyO32HGUASQ,-NN89JhzOvk,"L&#39;espion, le Covid et le truand ? Maxime Renahy [EN DIRECT]",2020-07-01T20:18:13Z,855908,10573,759,188,8099,Thinkerview,634000,FR,https://www.youtube.com/watch?v=-NN89JhzOvk
10,10,2020-06-28-2020-07-05,UCupvZG-5ko_eiXAupbDfxWw,nt06wMyE1zU,D.L. Hughley opens up about coronavirus battle,2020-07-03T14:37:22Z,603751,6290,1099,2767,402,CNN,10500000,Unknown,https://www.youtube.com/watch?v=nt06wMyE1zU
11,11,2020-06-28-2020-07-05,UCo7a6riBFJ3tkeHjvkXPn1g,7cgpMBRPj8o,How Hong Kong beat coronavirus and avoided lockdown | CNBC Reports,2020-06-29T21:00:02Z,591308,8900,367,1692,489,CNBC International,873000,GB,https://www.youtube.com/watch?v=7cgpMBRPj8o
12,12,2020-06-28-2020-07-05,UCZFMm1mMw0F81Z37aaEzTUA,YmdJT4feqm8,COVID-19 News: India&#39;s First Coronavirus Vaccine May Be Launched By August 15,2020-07-03T04:27:03Z,543220,4452,305,704,151,NDTV,8420000,IN,https://www.youtube.com/watch?v=YmdJT4feqm8
13,13,2020-06-28-2020-07-05,UCqVHGwQCmmGa2hjS7ydN4sQ,bhfBS4bFKOM,"IGG &amp; IGM PRUEBAS RAPIDAS EN EL COVID -19, ENTENDIENDO SU SIGNIFICADO [?]",2020-07-01T00:15:12Z,677397,13567,659,906,1189,Dr. Luis Antonio Pacora Camargo,260000,PE,https://www.youtube.com/watch?v=bhfBS4bFKOM
14,14,2020-06-28-2020-07-05,UCbHFKMtqLYkIBRiPHJwxu_w,Lrp3DWDMDpY,Guatemala: familias optan por la medicina tradicional contra COVID-19,2020-06-28T04:56:26Z,467612,5309,227,582,146,teleSUR tv,1160000,Unknown,https://www.youtube.com/watch?v=Lrp3DWDMDpY
15,15,2020-06-28-2020-07-05,UCxcrzzhQDj5zKJbXfIscCtg,U6FiIz6u0Yk,Lockdown Lite: Sweden&#39;s Model of Coronavirus Control | Foreign Correspondent,2020-06-30T10:00:11Z,441295,3499,772,3812,1798,ABC News In-depth,390000,AU,https://www.youtube.com/watch?v=U6FiIz6u0Yk
16,16,2020-06-28-2020-07-05,UCZYTClx2T1of7BRZ86-8fow,mIJYfsOyO4M,From Scarred Lungs to Diabetes: How COVID May Stick With People Long-Term | SciShow News,2020-07-03T21:00:14Z,391597,16846,353,1662,365,SciShow,6370000,US,https://www.youtube.com/watch?v=mIJYfsOyO4M
17,17,2020-06-28-2020-07-05,UCygsuqHrjo5Tv5L1hPzryog,s5hZMEHqwQ8,?COMO RECONOCER LOS SINTOMAS PELIGROSOS DEL COVID-19? - HACIA UN NUEVO ESTILO DE VIDA,2020-07-01T14:30:10Z,346755,5511,303,326,679,Hacia un Nuevo Estilo de Vida,297000,EC,https://www.youtube.com/watch?v=s5hZMEHqwQ8
18,18,2020-06-28-2020-07-05,UC9k-yiEpRHMNVOnOi_aQK8w,aWWqpb6f2Is,What to Wear on an Airplane to Protect Against COVID-19,2020-07-02T12:47:53Z,307428,6409,237,810,138,Inside Edition,7830000,US,https://www.youtube.com/watch?v=aWWqpb6f2Is
19,19,2020-06-28-2020-07-05,UCknLrEdhRCp1aegoMqRaCZg,q1p5t_GJHCY,Coronavirus update - Latest developments around the world | DW News,2020-07-01T11:04:20Z,231030,1743,171,597,545,DW News,1680000,DE,https://www.youtube.com/watch?v=q1p5t_GJHCY
20,20,2020-06-28-2020-07-05,UCGnDUCS4N9bbcIFC7Z2j8Zw,YmFnSH7wgsk,COVID-19 MCQs || CORONA Virus Questions,2020-06-29T03:45:12Z,348516,15992,549,603,885,OM Nursing Academy,258000,IN,https://www.youtube.com/watch?v=YmFnSH7wgsk
21,21,2020-06-28-2020-07-05,UCs6vRDdkZ8bP8Xt6WHbvrwA,ik5qhnqIZy8,The HU - Covid-19 Relief Effort Fundraising Concert,2020-06-28T17:59:31Z,253512,14454,96,1519,4575,The HU,864000,MN,https://www.youtube.com/watch?v=ik5qhnqIZy8
22,22,2020-06-28-2020-07-05,UCrp_UI8XtuYfpiqluWLD7Lw,7r8hOHxp8Pc,Six Flags already had problems before coronavirus - Will it survive?,2020-07-04T14:04:38Z,227373,1858,346,651,988,CNBC Television,863000,US,https://www.youtube.com/watch?v=7r8hOHxp8Pc
23,23,2020-06-28-2020-07-05,UC9GGzAhhvhJO1hL10-BcgNA,nuoS2G2pPb8,Commission d&#39;enquete Covid-19: Agnes Buzyn a passe beaucoup de temps a chercher ses notes,2020-07-01T16:22:30Z,170968,949,154,993,173,LeHuffPost,688000,FR,https://www.youtube.com/watch?v=nuoS2G2pPb8
24,24,2020-06-28-2020-07-05,UC_lEiu6917IJz03TnntWUaQ,_zXdoVieEf8,?Quienes son los mas protegidos ante el coronavirus?,2020-07-03T20:34:20Z,149846,2218,138,222,1758,CNN en Español,1960000,US,https://www.youtube.com/watch?v=_zXdoVieEf8
25,25,2020-06-28-2020-07-05,UCknLrEdhRCp1aegoMqRaCZg,hv_7IssX2dU,"Coronavirus cases in India pass 600,000 | Covid Update",2020-07-03T04:30:03Z,141375,1208,108,676,404,DW News,1680000,DE,https://www.youtube.com/watch?v=hv_7IssX2dU
26,26,2020-06-28-2020-07-05,UCSwXe2WReWhNdjKRTh92b9g,p8ozvtuPXtM,COVID DIAGNOSTICO,2020-06-28T18:08:19Z,135376,4222,104,219,2281,Dr. Veller,220000,AR,https://www.youtube.com/watch?v=p8ozvtuPXtM
27,27,2020-06-28-2020-07-05,UC16niRr50-MSBwiO3YDb3RA,l-5tvPJ0NQg,Covid survivors may face life-long brain injuries - BBC News,2020-06-30T21:40:20Z,110152,1545,183,767,180,BBC News,8240000,GB,https://www.youtube.com/watch?v=l-5tvPJ0NQg
28,28,2020-06-28-2020-07-05,UCUrYBZGlEOSD1_ds_HcNd6A,VPotngMLGmI,Asi es RADAR COVID: Probamos la aplicacion de rastreo de contactos de Espana contra el coronavirus,2020-06-30T11:44:39Z,100047,1034,662,583,388,Xataka TV,705000,ES,https://www.youtube.com/watch?v=VPotngMLGmI
29,29,2020-06-28-2020-07-05,UC7HAzXWJi2EgqMuBlpJ22iQ,zY_5SmDN-4o,COVID-19 Treatment at Home in Urdu/Hindi | Coronavirus Ka Asan Ilaj | khwrwn khymryD kh `lj,2020-06-29T12:30:10Z,109794,2019,130,216,974,oladoc - Find the Best Doctors,412000,PK,https://www.youtube.com/watch?v=zY_5SmDN-4o
